{
  "backlog": {
    "cluster": null,
    "dirty_keys_at_end": 0,
    "drain": null,
    "pending_batch_items_at_end": 0,
    "timeline": []
  },
  "command": "mix aurora_meter.bench correct --json /home/liamk/src/PhxTemplates/tmp/v1/bench/v1-rc1/runs/correct-3.json --label correct",
  "config": {
    "broadcast_interval": 3600000,
    "feature_sources": "%{ops: :events}",
    "flush_interval": 3600000,
    "history": true,
    "seed": 8066,
    "storage": "AuroraMeter.Storage.Ecto"
  },
  "correct": true,
  "database": {
    "container": "aurora-meter-pro-testdb",
    "database": "aurora_meter_bench",
    "host": "localhost",
    "pool_size": 30,
    "port": 5490,
    "server_version": "PostgreSQL 16.13 (Debian 16.13-1.pgdg13+1) on x86_64-pc-linux-gnu, compiled by gcc (Debian 14.2.0-19) 14.2.0, 64-bit",
    "used": true
  },
  "duration_ms": 6512.51,
  "errors": {
    "by_tag": {},
    "rate": 0.0,
    "total": 0
  },
  "finished_at": "2026-09-16T11:02:58.097631Z",
  "kind": "end_to_end",
  "label": "correct",
  "latency_us": {
    "max": 24012.93,
    "method": "nearest_rank",
    "p50": 6534.75,
    "p95": 7603.65,
    "p99": 8178.37,
    "sample_every": null,
    "sampled": false,
    "samples": 8000
  },
  "machine": {
    "cpu_model": "AMD Ryzen 9 7900X 12-Core Processor",
    "distribution": "Ubuntu 24.04.4 LTS",
    "logical_cpus": 24,
    "os": "unix/linux 6.6.87",
    "total_memory_bytes": 20969582592
  },
  "memory": {
    "after": {
      "binary": 752360,
      "ets": 2280472,
      "processes": 19752104,
      "total": 70405008
    },
    "after_warmup": {
      "binary": 739088,
      "ets": 2271264,
      "processes": 19422456,
      "total": 70015632
    },
    "before": {
      "binary": 725584,
      "ets": 2235088,
      "processes": 19350704,
      "total": 69830040
    },
    "counters_table_bytes": 118800
  },
  "mode": "correct",
  "notes": [
    "correct seeds procs x (warmup + per) originals of quantity 2 before the clock starts and reduces each by 1, so no correction can reach its original's cumulative bound and the measurement is the correction path rather than a refusal path.",
    "net quantity: 8800 (expected 8800)"
  ],
  "package": {
    "git_dirty": true,
    "git_sha": "34c188dbaa896562416aef21a4840872ba857e60",
    "name": "aurora_meter",
    "version": "0.5.0"
  },
  "run_id": "e72f8db3-4419-4d94-9d80-97957967a771",
  "runtime": {
    "elixir": "1.20.1",
    "erts": "17.0.1",
    "otp": "29",
    "schedulers_online": 24
  },
  "schema_version": 1,
  "started_at": "2026-09-16T11:02:50.906088Z",
  "throughput_ops_per_sec": 1228.4,
  "warmup": {
    "duration_ms": 667.6,
    "operations": 800
  },
  "workload": {
    "batch_size": 500,
    "keys": null,
    "operations": 8000,
    "original_quantity": 2,
    "originals": 8800,
    "per_proc": 1000,
    "procs": 8,
    "rounds": 5,
    "seed": 8066,
    "tenants": 8
  }
}
