{
  "backlog": {
    "cluster": null,
    "dirty_keys_at_end": 0,
    "drain": null,
    "pending_batch_items_at_end": 100000,
    "timeline": [
      {
        "duration_us": 2581407.79,
        "error": "\"postgresql protocol can not handle 700000 parameters, the maximum is 65535\"",
        "keys_built": 100000,
        "persisted": 0,
        "result": "error",
        "round": 1,
        "rows_per_second": 0.0
      }
    ]
  },
  "command": "mix aurora_meter.bench flush_100k --json /home/liamk/src/PhxTemplates/tmp/v1/bench/v1-rc1/runs/flush_100k-1.json --label flush_100k",
  "config": {
    "broadcast_interval": 3600000,
    "feature_sources": "%{}",
    "flush_interval": 3600000,
    "history": false,
    "seed": 4546,
    "storage": "AuroraMeter.Storage.Ecto"
  },
  "correct": false,
  "database": {
    "container": "aurora-meter-pro-testdb",
    "database": "aurora_meter_bench",
    "host": "localhost",
    "pool_size": 30,
    "port": 5490,
    "server_version": "PostgreSQL 16.13 (Debian 16.13-1.pgdg13+1) on x86_64-pc-linux-gnu, compiled by gcc (Debian 14.2.0-19) 14.2.0, 64-bit",
    "used": true
  },
  "duration_ms": 2581.41,
  "errors": {
    "by_tag": {
      "flush_failed": 1
    },
    "rate": 0.0,
    "total": 1
  },
  "finished_at": "2026-09-16T11:14:51.566763Z",
  "kind": "end_to_end",
  "label": "flush_100k",
  "latency_us": {
    "max": 2581407.79,
    "method": "nearest_rank",
    "p50": 2581407.79,
    "p95": 2581407.79,
    "p99": 2581407.79,
    "sample_every": null,
    "sampled": false,
    "samples": 1
  },
  "machine": {
    "cpu_model": "AMD Ryzen 9 7900X 12-Core Processor",
    "distribution": "Ubuntu 24.04.4 LTS",
    "logical_cpus": 24,
    "os": "unix/linux 6.6.87",
    "total_memory_bytes": 20969582592
  },
  "memory": {
    "after": {
      "binary": 11905560,
      "ets": 194070696,
      "processes": 398220912,
      "total": 651262984
    },
    "after_warmup": {
      "binary": 65971624,
      "ets": 1993800,
      "processes": 19635752,
      "total": 133807584
    },
    "before": {
      "binary": 65994136,
      "ets": 1991672,
      "processes": 20007088,
      "total": 134191160
    },
    "counters_table_bytes": 50523720
  },
  "mode": "flush_100k",
  "notes": [
    "each round makes 100000 distinct dirty counter keys with Counter.incr/4 and then times one synchronous Flusher.flush/0. duration_ms is the sum of the flushes only; building the dirty set is outside the clock. History is off, because a day bucket would be a second dirty key per increment and the mode's name would be wrong.",
    "the flush of 100000 dirty keys FAILED, so this run measures nothing: [\"\\\"postgresql protocol can not handle 700000 parameters, the maximum is 65535\\\"\"]. A failed flush retains its batch for an idempotent retry, so the remaining rounds were not run: they would have built more dirty keys on top of a batch that cannot be written.",
    "persisted total: 0 (expected 0)",
    "dirty keys at the end: 0 (expected 0)",
    "pending batch items at the end: 100000 (expected 0)",
    "flush receipts: 0 (one per successful round, 5 rounds requested)"
  ],
  "package": {
    "git_dirty": true,
    "git_sha": "34c188dbaa896562416aef21a4840872ba857e60",
    "name": "aurora_meter",
    "version": "0.5.0"
  },
  "run_id": "812ff484-8b7d-4873-ad21-245dc8e6b27f",
  "runtime": {
    "elixir": "1.20.1",
    "erts": "17.0.1",
    "otp": "29",
    "schedulers_online": 24
  },
  "schema_version": 1,
  "started_at": "2026-09-16T11:14:26.883715Z",
  "throughput_ops_per_sec": 0.0,
  "warmup": {
    "duration_ms": 0.0,
    "operations": 0
  },
  "workload": {
    "batch_size": 500,
    "dirty_keys": 100000,
    "keys": 100000,
    "operations": 0,
    "per_proc": 2000,
    "procs": 8,
    "rounds": 5,
    "seed": 4546,
    "tenants": 100000
  }
}
