{
  "backlog": {
    "cluster": null,
    "dirty_keys_at_end": 0,
    "drain": null,
    "pending_batch_items_at_end": 0,
    "timeline": []
  },
  "command": "mix aurora_meter.bench record --json /home/liamk/src/PhxTemplates/tmp/v1/bench/v1-rc1/runs/record-4.json --label record",
  "config": {
    "broadcast_interval": 3600000,
    "feature_sources": "%{ops: :events}",
    "flush_interval": 3600000,
    "history": true,
    "seed": 3544,
    "storage": "AuroraMeter.Storage.Ecto"
  },
  "correct": true,
  "database": {
    "container": "aurora-meter-pro-testdb",
    "database": "aurora_meter_bench",
    "host": "localhost",
    "pool_size": 30,
    "port": 5490,
    "server_version": "PostgreSQL 16.13 (Debian 16.13-1.pgdg13+1) on x86_64-pc-linux-gnu, compiled by gcc (Debian 14.2.0-19) 14.2.0, 64-bit",
    "used": true
  },
  "duration_ms": 8867.97,
  "errors": {
    "by_tag": {},
    "rate": 0.0,
    "total": 0
  },
  "finished_at": "2026-09-16T11:01:11.044250Z",
  "kind": "end_to_end",
  "label": "record",
  "latency_us": {
    "max": 11547.91,
    "method": "nearest_rank",
    "p50": 4230.57,
    "p95": 5213.47,
    "p99": 6710.56,
    "sample_every": null,
    "sampled": false,
    "samples": 16000
  },
  "machine": {
    "cpu_model": "AMD Ryzen 9 7900X 12-Core Processor",
    "distribution": "Ubuntu 24.04.4 LTS",
    "logical_cpus": 24,
    "os": "unix/linux 6.6.87",
    "total_memory_bytes": 20969582592
  },
  "memory": {
    "after": {
      "binary": 755656,
      "ets": 2252200,
      "processes": 20343792,
      "total": 71121712
    },
    "after_warmup": {
      "binary": 727944,
      "ets": 2238656,
      "processes": 19413488,
      "total": 69892856
    },
    "before": {
      "binary": 24147936,
      "ets": 2063832,
      "processes": 19633696,
      "total": 93045360
    },
    "counters_table_bytes": 118800
  },
  "mode": "record",
  "notes": [
    "projected total: 35200 (expected 35200)",
    "rows in aurora_meter_events: 17600"
  ],
  "package": {
    "git_dirty": true,
    "git_sha": "34c188dbaa896562416aef21a4840872ba857e60",
    "name": "aurora_meter",
    "version": "0.5.0"
  },
  "run_id": "4447bb47-46b1-4209-8200-67b1016ad47a",
  "runtime": {
    "elixir": "1.20.1",
    "erts": "17.0.1",
    "otp": "29",
    "schedulers_online": 24
  },
  "schema_version": 1,
  "started_at": "2026-09-16T11:01:01.208850Z",
  "throughput_ops_per_sec": 1804.25,
  "warmup": {
    "duration_ms": 940.01,
    "operations": 1600
  },
  "workload": {
    "batch_size": 1,
    "keys": null,
    "operations": 16000,
    "per_proc": 2000,
    "procs": 8,
    "rounds": 5,
    "seed": 3544,
    "tenants": 8
  }
}
